{
  "schema_version": "1.0-draft",
  "artifact_version": "chapter-1-v1",
  "status": "confirmed",
  "work_id": "lotm",
  "source_id": "ru-official",
  "chapter": 1,
  "mode": "manual_spans",
  "raw_sha256": "2a4339bb3ab5c7dc7cf4cd0dafd8bc8278ffafc565e227361c00c9a72a5df4dd",
  "raw_line_count": 65,
  "spans": [
    {"start_line": 1, "end_line": 1, "disposition": "paragraph", "reason": null, "note": "Chapter heading retained as a physical source paragraph."},
    {"start_line": 2, "end_line": 2, "disposition": "paragraph", "reason": null, "note": null},
    {"start_line": 3, "end_line": 4, "disposition": "paragraph", "reason": null, "note": null},
    {"start_line": 5, "end_line": 5, "disposition": "paragraph", "reason": null, "note": null},
    {"start_line": 6, "end_line": 6, "disposition": "paragraph", "reason": null, "note": null},
    {"start_line": 7, "end_line": 8, "disposition": "paragraph", "reason": null, "note": null},
    {"start_line": 9, "end_line": 9, "disposition": "paragraph", "reason": null, "note": null},
    {"start_line": 10, "end_line": 12, "disposition": "paragraph", "reason": null, "note": "Continues across the page boundary; line 13 starts with a new printed paragraph indent."},
    {"start_line": 13, "end_line": 13, "disposition": "paragraph", "reason": null, "note": null},
    {"start_line": 14, "end_line": 14, "disposition": "paragraph", "reason": null, "note": null},
    {"start_line": 15, "end_line": 16, "disposition": "paragraph", "reason": null, "note": null},
    {"start_line": 17, "end_line": 17, "disposition": "paragraph", "reason": null, "note": null},
    {"start_line": 18, "end_line": 18, "disposition": "paragraph", "reason": null, "note": null},
    {"start_line": 19, "end_line": 19, "disposition": "paragraph", "reason": null, "note": null},
    {"start_line": 20, "end_line": 21, "disposition": "paragraph", "reason": null, "note": null},
    {"start_line": 22, "end_line": 22, "disposition": "paragraph", "reason": null, "note": null},
    {"start_line": 23, "end_line": 23, "disposition": "paragraph", "reason": null, "note": null},
    {"start_line": 24, "end_line": 24, "disposition": "paragraph", "reason": null, "note": null},
    {"start_line": 25, "end_line": 26, "disposition": "paragraph", "reason": null, "note": null},
    {"start_line": 27, "end_line": 27, "disposition": "paragraph", "reason": null, "note": null},
    {"start_line": 28, "end_line": 28, "disposition": "paragraph", "reason": null, "note": null},
    {"start_line": 29, "end_line": 29, "disposition": "paragraph", "reason": null, "note": null},
    {"start_line": 30, "end_line": 31, "disposition": "paragraph", "reason": null, "note": null},
    {"start_line": 32, "end_line": 32, "disposition": "paragraph", "reason": null, "note": null},
    {"start_line": 33, "end_line": 33, "disposition": "paragraph", "reason": null, "note": null},
    {"start_line": 34, "end_line": 34, "disposition": "paragraph", "reason": null, "note": null},
    {"start_line": 35, "end_line": 35, "disposition": "paragraph", "reason": null, "note": null},
    {"start_line": 36, "end_line": 36, "disposition": "paragraph", "reason": null, "note": null},
    {"start_line": 37, "end_line": 37, "disposition": "paragraph", "reason": null, "note": null},
    {"start_line": 38, "end_line": 38, "disposition": "paragraph", "reason": null, "note": null},
    {"start_line": 39, "end_line": 39, "disposition": "paragraph", "reason": null, "note": null},
    {"start_line": 40, "end_line": 41, "disposition": "paragraph", "reason": null, "note": null},
    {"start_line": 42, "end_line": 42, "disposition": "paragraph", "reason": null, "note": null},
    {"start_line": 43, "end_line": 43, "disposition": "paragraph", "reason": null, "note": null},
    {"start_line": 44, "end_line": 44, "disposition": "paragraph", "reason": null, "note": null},
    {"start_line": 45, "end_line": 45, "disposition": "paragraph", "reason": null, "note": null},
    {"start_line": 46, "end_line": 47, "disposition": "paragraph", "reason": null, "note": null},
    {"start_line": 48, "end_line": 48, "disposition": "paragraph", "reason": null, "note": null},
    {"start_line": 49, "end_line": 49, "disposition": "paragraph", "reason": null, "note": null},
    {"start_line": 50, "end_line": 51, "disposition": "paragraph", "reason": null, "note": "Continues across the printed page boundary."},
    {"start_line": 52, "end_line": 52, "disposition": "paragraph", "reason": null, "note": null},
    {"start_line": 53, "end_line": 53, "disposition": "paragraph", "reason": null, "note": null},
    {"start_line": 54, "end_line": 54, "disposition": "paragraph", "reason": null, "note": null},
    {"start_line": 55, "end_line": 55, "disposition": "paragraph", "reason": null, "note": null},
    {"start_line": 56, "end_line": 56, "disposition": "paragraph", "reason": null, "note": null},
    {"start_line": 57, "end_line": 57, "disposition": "paragraph", "reason": null, "note": null},
    {"start_line": 58, "end_line": 58, "disposition": "paragraph", "reason": null, "note": null},
    {"start_line": 59, "end_line": 59, "disposition": "paragraph", "reason": null, "note": null},
    {"start_line": 60, "end_line": 60, "disposition": "paragraph", "reason": null, "note": null},
    {"start_line": 61, "end_line": 61, "disposition": "paragraph", "reason": null, "note": null},
    {"start_line": 62, "end_line": 62, "disposition": "paragraph", "reason": null, "note": null},
    {"start_line": 63, "end_line": 63, "disposition": "paragraph", "reason": null, "note": null},
    {"start_line": 64, "end_line": 64, "disposition": "paragraph", "reason": null, "note": null},
    {"start_line": 65, "end_line": 65, "disposition": "paragraph", "reason": null, "note": null}
  ],
  "note": "Physical paragraph boundaries reconstructed only from the reviewed official Russian OCR source and chapter photographs IMG_8486.JPG through IMG_8491.JPG. No ZH/EN alignment evidence was used. All 65 non-empty raw lines are retained; there are no exclusions."
}
